{
  "$schema": "http://json-schema.org/draft-07/schema#",
  "$id": "scripts/plan-schema.json",
  "title": "Машиночитаемый план реализации",
  "description": "Единственный источник формы плана. Читают её трое: шаг планирования (заполняет docs/tasks/<N>.plan.json), scripts/plan.sh (берёт отсюда required, properties, enum, pattern, oneOf и заголовки разделов), scripts/plan.test.sh (сверяет полноту согласованной фикстуры). Своей копии списка полей нет ни у кого: копия разъезжается молча. Разделы и их порядок — docs/rules/plan.md; заголовок раздела живёт в x-title, номер в x-section, поле без раздела печатается внутри раздела из x-render-into.",
  "type": "object",
  "additionalProperties": false,
  "required": [
    "issue",
    "current_state",
    "approach",
    "fork_card",
    "files",
    "boundaries",
    "flags",
    "tests",
    "acceptance",
    "risks",
    "out_of_scope"
  ],
  "properties": {
    "issue": {
      "type": "integer",
      "description": "Номер задачи, к которой относится план.",
      "x-render-into": 0
    },
    "current_state": {
      "type": "array",
      "minItems": 1,
      "x-section": 1,
      "x-title": "Как устроено сейчас",
      "description": "Наблюдения о том, что уже есть в коде: путь, строка, что именно там увидено. Раздел показывает, что существующее прочитано, поэтому наблюдение без ссылки на файл сюда не годится — валидатор проверяет, что путь существует, а номер строки не выходит за длину файла.",
      "items": {
        "type": "object",
        "additionalProperties": false,
        "required": ["path", "line", "observation"],
        "properties": {
          "path": {
            "type": "string",
            "minLength": 1,
            "description": "Путь от корня репозитория."
          },
          "line": {
            "type": "integer",
            "description": "Номер строки. 0 — наблюдение о файле целиком."
          },
          "observation": {
            "type": "string",
            "minLength": 1,
            "description": "Что именно там увидено. Не пересказ назначения файла, а факт, на который опирается план."
          }
        }
      }
    },
    "bug_analysis": {
      "type": "object",
      "x-render-into": 1,
      "x-label": "Разбор бага",
      "description": "Только для бага, и тогда обязателен по docs/rules/plan.md: воспроизведение идёт до плана, а план называет, что именно воспроизведено и почему. Четыре поля разбора; поле необязательно в схеме, потому что задача не обязана быть багом.",
      "additionalProperties": false,
      "required": ["symptom", "precondition", "root_cause", "rejected_hypotheses"],
      "properties": {
        "symptom": {
          "type": "string",
          "minLength": 1,
          "description": "Что наблюдается: фактический текст падения красного прогона, а не пересказ."
        },
        "precondition": {
          "type": "string",
          "minLength": 1,
          "description": "Различающее предусловие: при каком условии дефект проявляется и при каком нет."
        },
        "root_cause": {
          "type": "string",
          "minLength": 1,
          "pattern": "^[^:]+:[1-9][0-9]*$",
          "description": "Первопричина в виде файл:строка от корня репозитория. Валидатор проверяет, что путь существует, а строка не выходит за длину файла."
        },
        "rejected_hypotheses": {
          "type": "array",
          "description": "Отвергнутые гипотезы о первопричине, каждая с причиной отказа одной строкой. Пустой массив допустим: гипотеза была одна.",
          "items": {
            "type": "string",
            "minLength": 1
          }
        }
      }
    },
    "approach": {
      "type": "object",
      "x-section": 2,
      "x-title": "Подход",
      "description": "Одно решение, а не перечень вариантов. Отвергнутые называются строкой с причиной.",
      "additionalProperties": false,
      "required": ["summary", "rejected"],
      "properties": {
        "summary": {
          "type": "string",
          "minLength": 1,
          "description": "Выбранное решение целиком."
        },
        "rejected": {
          "type": "array",
          "description": "Отвергнутые варианты. Пустой массив допустим: вариант был один.",
          "items": {
            "type": "object",
            "additionalProperties": false,
            "required": ["option", "reason"],
            "properties": {
              "option": {
                "type": "string",
                "minLength": 1,
                "description": "Отвергнутый вариант."
              },
              "reason": {
                "type": "string",
                "minLength": 1,
                "description": "Почему отвергнут."
              }
            }
          }
        }
      }
    },
    "fork_card": {
      "type": "object",
      "x-render-into": 2,
      "x-label": "Карточка развилки",
      "description": "Заполняется до первой правки кода. Либо одна строка trivial для тривиальной правки, либо карточка целиком — вариант выбирается по oneOf, смешанная форма не проходит ни один.",
      "oneOf": [
        {
          "type": "object",
          "additionalProperties": false,
          "required": ["trivial"],
          "properties": {
            "trivial": {
              "type": "string",
              "minLength": 1,
              "description": "Тривиальная правка: одна строка вместо карточки — что правится и почему развилки здесь быть не может."
            }
          }
        },
        {
          "type": "object",
          "additionalProperties": false,
          "required": ["matches_request", "alternative", "ripple", "workaround", "council_signs", "executor", "fork"],
          "properties": {
            "matches_request": {
              "type": "string",
              "minLength": 1,
              "description": "Совпадает ли выбранное с просьбой задачи, и если нет — в чём расхождение."
            },
            "alternative": {
              "type": "string",
              "minLength": 1,
              "description": "Второй реалистичный способ и что пользователь или владелец увидел бы иначе, включая цену. Может быть «нет»."
            },
            "ripple": {
              "type": "string",
              "minLength": 1,
              "description": "Что ещё меняется — по грепу вызывающих, а не по памяти."
            },
            "workaround": {
              "type": "string",
              "minLength": 1,
              "description": "Костыль ли это, и если да — почему системное решение не выбрано."
            },
            "council_signs": {
              "type": "array",
              "description": "Сработавшие признаки совета (docs/rules/README.md). Пустой массив допустим: не сработал ни один.",
              "items": {
                "type": "string",
                "minLength": 1
              }
            },
            "executor": {
              "type": "string",
              "minLength": 1,
              "description": "Кто правит — оркестратор сам или субагент; счёт по задаче целиком."
            },
            "slices": {
              "type": "array",
              "minItems": 1,
              "description": "Раскладка файлов плана на срезы реализации. В схеме необязательно: форма проверяется и при --at, а исторические планы срезов не несут. Требование среза, непересекаемость, покрытие files (кроме docs/tasks/**), ссылки after и отсутствие циклов проверяет scripts/plan.sh, кроме запуска с --at.",
              "items": {
                "type": "object",
                "additionalProperties": false,
                "required": ["name", "files", "contract", "after"],
                "properties": {
                  "name": {
                    "type": "string",
                    "minLength": 1,
                    "description": "Имя среза, уникальное в плане; на него ссылается after."
                  },
                  "files": {
                    "type": "array",
                    "description": "Файлы плана, которые правит этот срез; файл принадлежит ровно одному срезу.",
                    "items": {
                      "type": "string",
                      "minLength": 1
                    }
                  },
                  "contract": {
                    "type": "string",
                    "minLength": 1,
                    "description": "Что срез обещает соседям: интерфейсы, имена, формат данных."
                  },
                  "after": {
                    "type": "array",
                    "description": "Имена срезов, после которых этот переносится на ветку задачи. Пустой массив — срез ни от кого не зависит.",
                    "items": {
                      "type": "string",
                      "minLength": 1
                    }
                  }
                }
              }
            },
            "single_slice_reason": {
              "type": "string",
              "description": "Почему задачу нельзя разрезать, если срез один. Пустая строка допустима, когда срезов больше одного."
            },
            "fork": {
              "type": "boolean",
              "description": "Развилка: второй способ даёт иной наблюдаемый результат, и выбор не следует из задачи или ТЗ. true — триггер «позвать человека»."
            }
          }
        }
      ]
    },
    "files": {
      "type": "array",
      "minItems": 1,
      "x-section": 3,
      "x-title": "Файлы",
      "description": "Что создаётся, что меняется, что удаляется, по каждому — зачем. Пути отсюда читает и scripts/risk.sh plan.",
      "items": {
        "type": "object",
        "additionalProperties": false,
        "required": ["path", "action", "why"],
        "properties": {
          "path": {
            "type": "string",
            "minLength": 1,
            "description": "Путь от корня репозитория."
          },
          "action": {
            "type": "string",
            "enum": ["create", "modify", "delete"],
            "description": "Что с файлом делается. Для modify и delete валидатор проверяет, что путь существует."
          },
          "why": {
            "type": "string",
            "minLength": 1,
            "description": "Зачем этот файл в плане."
          }
        }
      }
    },
    "boundaries": {
      "type": "array",
      "minItems": 1,
      "x-render-into": 3,
      "x-label": "Границы задачи",
      "description": "Пути и маски, за которые план не выходит. Поддержаны * (внутри одного сегмента) и ** (любая глубина). Каждый путь из files обязан попадать хотя бы под одну границу.",
      "items": {
        "type": "string",
        "minLength": 1
      }
    },
    "flags": {
      "type": "object",
      "x-render-into": 3,
      "x-label": "Флаги",
      "description": "Явные объявления плана, которые не выводятся из путей.",
      "additionalProperties": false,
      "required": ["new_dependency", "new_dependency_reason"],
      "properties": {
        "new_dependency": {
          "type": "boolean",
          "description": "План вводит новую библиотеку. Правила проекта требуют обоснования в комментарии к issue до установки."
        },
        "new_dependency_reason": {
          "type": "string",
          "description": "Обоснование новой зависимости со ссылкой на комментарий issue (#номер или URL). Пустая строка при new_dependency=false."
        }
      }
    },
    "tests": {
      "type": "array",
      "minItems": 1,
      "x-section": 4,
      "x-title": "Тесты",
      "description": "Какие тесты появятся и какое поведение каждый проверяет. Тест, проходящий при сломанной реализации, хуже отсутствующего, поэтому behavior формулирует поведение, а не «покрытие класса».",
      "items": {
        "type": "object",
        "additionalProperties": false,
        "required": ["name", "file", "new", "covers", "behavior"],
        "properties": {
          "name": {
            "type": "string",
            "minLength": 1,
            "description": "Имя теста или сценария так, как оно будет выглядеть в коде."
          },
          "file": {
            "type": "string",
            "minLength": 1,
            "description": "Файл, в котором тест живёт."
          },
          "new": {
            "type": "boolean",
            "description": "Тест появляется этой задачей. Валидатор проверяет, что имени ещё нет в дереве: существующий тест, выданный за новый, — приписанная работа."
          },
          "covers": {
            "type": "array",
            "minItems": 1,
            "description": "Идентификаторы пунктов контракта приёмки, которые этот тест закрывает.",
            "items": {
              "type": "string",
              "minLength": 1
            }
          },
          "behavior": {
            "type": "string",
            "minLength": 1,
            "description": "Какое поведение проверяется."
          }
        }
      }
    },
    "acceptance": {
      "type": "array",
      "minItems": 1,
      "x-section": 5,
      "x-title": "Контракт приёмки",
      "x-unverifiable": "непроверяем",
      "description": "Строка на каждый пункт критерия готовности из issue: пункт, способ проверки, доказательство. Пустая ячейка не допускается — она не отличает «способа нет, и вот почему» от «забыли заполнить». Способа нет — в method стоит значение из x-unverifiable, а в evidence причина, почему его нет.",
      "items": {
        "type": "object",
        "additionalProperties": false,
        "required": ["id", "criterion", "method", "evidence"],
        "properties": {
          "id": {
            "type": "string",
            "minLength": 1,
            "description": "Короткий идентификатор пункта, на который ссылаются tests[].covers."
          },
          "criterion": {
            "type": "string",
            "minLength": 1,
            "description": "Пункт критерия готовности из issue."
          },
          "method": {
            "type": "string",
            "description": "Команда с ожидаемым результатом, запрос или наблюдение. Либо значение из x-unverifiable."
          },
          "evidence": {
            "type": "string",
            "description": "Что считается доказательством: вывод команды, число, цитата файл:строка. При непроверяем — причина, почему способа нет."
          }
        }
      }
    },
    "risks": {
      "type": "array",
      "minItems": 1,
      "x-section": 6,
      "x-title": "Риски",
      "description": "Что может пойти не так и что с этим делается.",
      "items": {
        "type": "object",
        "additionalProperties": false,
        "required": ["risk", "mitigation"],
        "properties": {
          "risk": {
            "type": "string",
            "minLength": 1,
            "description": "Что может пойти не так."
          },
          "mitigation": {
            "type": "string",
            "minLength": 1,
            "description": "Мера. «Быть внимательным» мерой не считается."
          }
        }
      }
    },
    "out_of_scope": {
      "type": "array",
      "minItems": 1,
      "x-section": 7,
      "x-title": "Что не входит",
      "description": "Границы задачи словами. Замеченное попутно — новая issue, а не незапланированная правка.",
      "items": {
        "type": "string",
        "minLength": 1
      }
    }
  }
}
