{
  "issue": 81,
  "current_state": [
    {
      "path": "docs/decisions/0018-local-orchestrator-and-step-subagents.md",
      "line": 38,
      "observation": "ближайшее по смыслу место: наружу субагент не пишет, метки ставит оркестратор — а про то, кто правит саму конфигурацию прав шага, не сказано нигде"
    },
    {
      "path": "docs/decisions/0018-local-orchestrator-and-step-subagents.md",
      "line": 48,
      "observation": "раздел про хук говорит, где живёт список команд, но не кто его меняет"
    },
    {
      "path": ".claude/CLAUDE.md",
      "line": 83,
      "observation": "перечень «что оркестратор делает сам» — четыре пункта: публикация наружу, метки стадии, журнал шагов без права записи, запуск оценки случайности падения"
    },
    {
      "path": ".claude/agents/step-implement.md",
      "line": 26,
      "observation": "субагент обязан читать семь разделов указателя, «Локального режима» среди них нет — и правильно: адресат правила оркестратор, а он читает файл целиком"
    },
    {
      "path": "scripts/rules-sync.sh",
      "line": 336,
      "observation": "проверка требует упоминания каждого файла правил в указателе"
    },
    {
      "path": "scripts/rules-sync.sh",
      "line": 382,
      "observation": "проверка копий сравнивает указатель со всеми файлами правил скользящим окном в десять слов; записи решений в ней не участвуют"
    },
    {
      "path": ".github/workflows/agent-plan.yml",
      "line": 89,
      "observation": "границы шага цикла задаёт список разрешённых инструментов при вызове модели, а не отдельный механизм"
    },
    {
      "path": ".github/workflows/agent-review.yml",
      "line": 227,
      "observation": "то же и у ревью: список инструментов перечислен прямо в вызове"
    },
    {
      "path": ".github/workflows/agent-implement.yml",
      "line": 133,
      "observation": "у реализации в списке есть правка файлов, но нет ни одной команды записи меток — метки agent/allow-* агент себе не ставит"
    },
    {
      "path": ".github/workflows/ci-fast.yml",
      "line": 172,
      "observation": "гейт целостности подключён и читает метки самого PR, а не задачи"
    },
    {
      "path": "scripts/guard.sh",
      "line": 244,
      "observation": "путь пайплайна входит в список защищённых, поэтому правка рамок шага в цикле красит PR и мержится человеком"
    },
    {
      "path": "docs/pipeline.md",
      "line": 87,
      "observation": "разделение меток на агентские и человеческие сказано прямо: разрешительные ставит человек"
    }
  ],
  "approach": {
    "summary": "Дополнить запись 0018 одним новым разделом «Кто правит конфигурацию прав шага» перед разделом отвергнутого. В разделе три вещи по порядку: правило — правки, расширяющие права шага, делает оркестратор, а не шаг реализации; почему — в сессии субагента человека нет, а метка есть утверждение «человек посмотрел», а не канал передачи согласия внутрь субагента; как это стоит в цикле — подразделом по трём проверенным фактам. Обоснование формулируется через отсутствие человека в сессии, а не через наличие классификатора: поведение классификатора есть свойство версии инструмента и может измениться, а правило от этого устареть не должно. В указателе — пятый пункт перечня со ссылкой на запись, без пересказа обоснования.",
    "rejected": [
      {
        "option": "отдельная запись решения рядом с 0018",
        "reason": "решением владельца: разорвала бы одну мысль пополам"
      },
      {
        "option": "правка списков инструментов в процессах цикла",
        "reason": "решением владельца: механизм цикла на вопрос отвечает сам, и запись это фиксирует"
      },
      {
        "option": "новая механическая проверка в сверке правил",
        "reason": "это отдельная задача #82"
      },
      {
        "option": "правка docs/rules/implement.md",
        "reason": "адресат правила оркестратор, а не шаг реализации"
      }
    ]
  },
  "fork_card": {
    "matches_request": "да: правило о том, кто правит конфигурацию прав шага, ложится разделом в запись 0018 и пунктом указателя, как просит задача",
    "alternative": "отдельная запись решения рядом с 0018 — читатель получил бы одну мысль в двух записях; отвергнуто решением владельца",
    "ripple": "указатель .claude/CLAUDE.md получает пятый пункт со ссылкой на запись; ни один скрипт и ни одно определение шага правкой не затронуты",
    "workaround": "нет: правило записывается в запись решения, механизм не обходится",
    "council_signs": ["правка обвязки"],
    "executor": "субагент шага реализации",
    "fork": false
  },
  "files": [
    {
      "path": "docs/decisions/0018-local-orchestrator-and-step-subagents.md",
      "action": "modify",
      "why": "новый раздел «Кто правит конфигурацию прав шага» с подразделом про цикл и одна строка в «Что рассматривалось и отвергнуто»"
    },
    {
      "path": ".claude/CLAUDE.md",
      "action": "modify",
      "why": "пятый пункт перечня «что оркестратор делает сам» со ссылкой на запись 0018, без пересказа обоснования"
    },
    {
      "path": "docs/tasks/81.md",
      "action": "create",
      "why": "журнал: стадия, решения, изменённые файлы, что проверено"
    }
  ],
  "boundaries": [
    "docs/decisions/**",
    ".claude/CLAUDE.md",
    "docs/tasks/**"
  ],
  "flags": {
    "new_dependency": false,
    "new_dependency_reason": ""
  },
  "tests": [
    {
      "name": "прогон сверки правил после правки указателя",
      "file": "scripts/rules-sync.sh",
      "new": false,
      "covers": ["pointer-references-record", "rules-sync-green"],
      "behavior": "правка указателя задевает проверку упоминания правил и проверку копий; базовая точка до правок — код 0, поэтому позднее падение будет отнесено к этому диффу"
    },
    {
      "name": "прогон харнесса сверки правил",
      "file": "scripts/rules-sync.test.sh",
      "new": false,
      "covers": ["rules-sync-green"],
      "behavior": "сама сверка не сломана правкой вокруг неё: сценариев пройдено 25, провалено 0"
    },
    {
      "name": "чтение нового раздела записи 0018",
      "file": "docs/decisions/0018-local-orchestrator-and-step-subagents.md",
      "new": false,
      "covers": ["decision-record-updated"],
      "behavior": "правило, обоснование и подраздел про цикл стоят в записи; прежний текст не переписан, статус записи не изменён"
    },
    {
      "name": "сверка даты ответов владельца с датой первого коммита ветки",
      "file": "docs/tasks/81.md",
      "new": false,
      "covers": ["decision-before-edits"],
      "behavior": "решение владельца опубликовано комментарием раньше первого коммита ветки и продублировано таблицей в журнале"
    }
  ],
  "acceptance": [
    {
      "id": "decision-before-edits",
      "criterion": "Решение записано в issue до правок",
      "method": "чтение комментария владельца в задаче и даты первого коммита ветки",
      "evidence": "четыре ответа владельца в комментарии, продублированы таблицей в docs/tasks/81.md; дата комментария раньше даты коммита"
    },
    {
      "id": "decision-record-updated",
      "criterion": "Запись в docs/decisions создана или дополнена, защищённый путь покрыт меткой",
      "method": "чтение диффа записи 0018 и меток PR",
      "evidence": "новый раздел в записи; метка agent/allow-protected стоит на PR — гейт читает метки PR, а не задачи"
    },
    {
      "id": "pointer-references-record",
      "criterion": "Указатель называет раздел, а источником остаётся запись решения",
      "method": "чтение пятого пункта перечня в указателе",
      "evidence": "пункт короткий и ссылается на запись 0018; обоснование живёт только в записи, копии в указателе нет"
    },
    {
      "id": "rules-sync-green",
      "criterion": "Сверка правил зелёная после правок",
      "method": "bash scripts/rules-sync.sh и bash scripts/rules-sync.test.sh",
      "evidence": "код возврата 0, расхождений 0 — в том числе на дереве вместе с правкой указателя владельцем; харнесс: пройдено 25, провалено 0"
    }
  ],
  "risks": [
    {
      "risk": "Проверка копий сверки правил на новом пункте указателя: окно в десять слов сравнивается со всеми файлами правил, и формулировка про то, кто делает правку, рискует совпасть с правилами реализации или починки.",
      "mitigation": "короткий пункт со ссылкой вместо абзаца и прогон сверки сразу после правки"
    },
    {
      "risk": "Указатель записей решений говорит, что записи не переписываются.",
      "mitigation": "дополнение не отмена: прежний текст не правится, статус остаётся, строка указателя не меняется; сказать это в PR одной строкой"
    },
    {
      "risk": "Классификатор прав локальной сессии может отбить и эту правку.",
      "mitigation": "шаг не давит и не обходит: выносит расхождение в тело PR, правку делает оркестратор — ровно то правило, которое задача и записывает"
    },
    {
      "risk": "Метка на PR отдельно от метки на задаче: без неё гейт целостности красит PR по первой же проверке.",
      "mitigation": "предусловие названо заранее, метку ставит человек; агент себе гейт не снимает"
    },
    {
      "risk": "Непроверяемые утверждения: запись не говорит ничего про права токена цикла и не описывает поведение классификатора как механизм проекта.",
      "mitigation": "всё про цикл опирается на строки файлов, названные в разделе «Как устроено сейчас», а наблюдение приводится как то, чем правило обнаружено, а не как его основание"
    }
  ],
  "out_of_scope": [
    "Классификатор прав локальной сессии и разбор строк в границе команд шага",
    "Правка списков разрешённых инструментов в процессах агентского цикла",
    "Рамки определений шагов и механическая сверка этих рамок — отдельные задачи",
    "docs/pipeline.md — от нового пункта не устаревает",
    "Устаревшая формулировка про гейт целостности в указателе и в CODEOWNERS — попутная находка, уходит отдельной issue"
  ]
}
